<?xml version="1.0" encoding="UTF-8" ?> 
<!--
================================================================
Copyright (c) 2004 - 2006 Oracle. All rights reserved.
This material is the confidential property of Oracle Corporation or its
licensors and may be used, reproduced, stored or transmitted only in
accordance with a valid Oracle license or sublicense agreement.
================================================================
-->

<AccountReceivablesConfiguration xmlns="http://www.portal.com/PortalXMLSchema" 
xmlns:xsi="http://www.w3.org/2001/XMLSchema-instance" 
xsi:schemaLocation="http://www.portal.com/PortalXMLSchema ../../../xsd/pin_config_ar_taxes.xsd">
  <TaxConfigurationList>
    <TaxConfiguration>
      <Event>/event/billing/adjustment/item</Event>
      <Name>TS1</Name>
      <TaxCode>user_code</TaxCode>
    </TaxConfiguration>
    <TaxConfiguration>
      <Event>/event/billing/dispute/item</Event>
      <Name>TS1</Name>
      <TaxCode>user_code</TaxCode>
    </TaxConfiguration>
    <TaxConfiguration>
      <Event>/event/billing/settlement/item</Event>
      <Name>TS1</Name>
      <TaxCode>user_code</TaxCode>
    </TaxConfiguration>
    <TaxConfiguration>
      <Event>/event/billing/adjustment/account</Event>
      <Name>TS1</Name>
      <TaxCode>user_code</TaxCode>
    </TaxConfiguration>
  </TaxConfigurationList>
</AccountReceivablesConfiguration>
